{
  "port": 9500,
  "host": "localhost",
  "delay": {
    "enabled": false,
    "min": 100,
    "max": 1000
  },
  "chaos": {
    "enabled": false,
    "globalErrorRate": 0.01
  },
  "cors": {
    "enabled": true,
    "origins": [
      "*"
    ]
  },
  "logging": {
    "level": "info",
    "format": "pretty",
    "requests": true
  },
  "resources": [
    {
      "id": "items",
      "name": "Items",
      "endpoint": "/api/items",
      "method": "GET",
      "count": 20,
      "fields": {
        "id": "uuid",
        "name": "sentence",
        "description": "paragraph",
        "createdAt": "date:recent"
      }
    }
  ]
}